{
  "schemaVersion": 1,
  "caseId": "case-community-sample-001",
  "version": "1.0.0",
  "publisherId": "ldm-team",
  "title": "消失的备用钥匙",
  "subtitle": "The Missing Spare Key",
  "summary": "管理员办公室的备用钥匙在交接前消失。请检查本地文件、消息与访问记录。",
  "language": "zh-CN",
  "additionalLanguages": ["en"],
  "difficulty": "easy",
  "estimatedMinutes": { "min": 10, "max": 15 },
  "tags": ["教学案件", "办公室", "时间线", "文件记录", "适合新手"],
  "contentRating": "general",
  "contentWarnings": [],
  "engineCompatibility": { "minimum": "0.5.0" },
  "packageFile": "case-community-sample-001-1.0.0.ldmcase",
  "changelogFile": "CHANGELOG.md",
  "screenshotFiles": ["screenshots/cover.png", "screenshots/desktop.png", "screenshots/evidence-board.png"],
  "license": { "name": "MIT", "url": "https://opensource.org/license/mit" },
  "distributionConsent": true,
  "saveCompatibility": { "mode": "compatible", "compatibleFromVersions": ["1.0.0"], "notes": "首个版本。" },
  "status": "active",
  "moderation": { "automatedValidationRequired": true, "curated": true, "featured": true, "notes": "维护者教学示例，已完成基本体验检查。" },
  "publishedAt": "2026-08-31T00:00:00.000Z",
  "updatedAt": "2026-08-31T00:00:00.000Z"
}
