{
  "schemaVersion": 1,
  "caseId": "case-your-case-id",
  "version": "1.0.0",
  "publisherId": "your-publisher-id",
  "title": "案件标题",
  "summary": "用一段不剧透的文字说明调查背景与玩家目标。",
  "language": "zh-CN",
  "additionalLanguages": [],
  "difficulty": "normal",
  "estimatedMinutes": { "min": 20, "max": 30 },
  "tags": ["悬疑"],
  "contentRating": "general",
  "contentWarnings": [],
  "engineCompatibility": { "minimum": "0.5.0" },
  "packageFile": "case-your-case-id-1.0.0.ldmcase",
  "changelogFile": "CHANGELOG.md",
  "screenshotFiles": ["screenshots/cover.webp"],
  "license": { "name": "MIT", "url": "https://opensource.org/license/mit" },
  "distributionConsent": true,
  "saveCompatibility": { "mode": "compatible", "compatibleFromVersions": ["1.0.0"] },
  "status": "active",
  "moderation": { "automatedValidationRequired": true, "curated": false, "featured": false },
  "publishedAt": "2026-08-31T00:00:00.000Z",
  "updatedAt": "2026-08-31T00:00:00.000Z"
}
